{
  "version": "1.0",
  "mode": "mono-repo",
  "figma": {
    "apiBaseUrl": "https://api.figma.com/v1",
    "credentials": {
      "source": "ci-secret",
      "secretName": "FIGMA_PAT"
    }
  },
  "excluded": ["app-bff"],
  "repo": {
    "enabled": true,
    "role": "app-host",
    "figmaFileId": "mono123FILE",
    "submodulePath": ".",
    "monorepo": {
      "type": "nx",
      "apps": ["app-storefront", "app-checkout"],
      "libs": ["design-system", "lib-ui-shared"]
    }
  }
}
